Company_Name,Company_Profile,Overview,Website,Phone,Industry,Company_size,Company_size_Linkedin,Headquarters,Founded,Specialties
Marfin Investment Group (MIG),https://www.linkedin.com/company/2158045/about/,"Marfin Investment Group Holdings S.A. (MIG) is an international investment holding company headquartered in Greece, with operations in both Greece and Southeast Europe (SEE).
MIG believes it is uniquely positioned to take advantage of an expanding array of investment opportunities in this region; opportunities in which traditional investment vehicles lacking MIG’s regional focus, scale, expertise, and/or its investment flexibility and financial resources, may find difficult to identify and exploit.
MIG in its current structure has been listed on the Athens Stock Exchange since July 2007. Its portfolio includes sector-leading companies, grouped into Food & Dairy, Transportation & Shipping, Healthcare, IT, Real Estate and Tourism & Leisure.
Included amongst its portfolio and subsidiary companies is Attica Group, a leading passenger ferry operator in the Eastern Mediterranean; Vivartia, a leader in the dairy, frozen foods & vegetables and quick service restaurants business in Greece; Hygeia Group, a prominent integrated private hospitals and clinics group, with the leading general hospital facilities and maternity clinics in Greece; SingularLogic, the leading comprehensive IT services provider in Greece; Hilton Cyprus, the only 5-star hotel in the capital city of Nicosia and Robne Kuce Beograd (RKB), owner of the largest commercial real-estate portfolio in Serbia.",http://www.marfininvestmentgroup.com,,Investment Management,"10,001+ employees",19 employees on LinkedIn,,2007,
Credit Suisse,https://www.linkedin.com/company/1284/about/,"Credit Suisse is a leading global wealth manager with strong investment banking capabilities. Headquartered in Zurich, Switzerland, our operation has a global reach and extends to about 50 countries worldwide across mature and emerging markets with more than 45,000 employees from over 150 different nations.

We partner across countries, divisions and regions to deliver holistic financial solutions to our clients, including innovative products and specially tailored advice, aligned to our high ethical standards. We strive for quality and excellence in our work and professional relationships, recognizing and rewarding extraordinary performance among our employees and providing opportunities for internal mobility, dedicated training and leadership. 

As a global and inclusive community, we benefit from a diverse range of perspectives to create value and drive results for our clients, shareholders and communities. Our values are brought to life through the entrepreneurial spirit of all within our network. We are Credit Suisse.

Social Media Disclaimer and guidelines: http://bit.ly/2KCQhO6",http://www.credit-suisse.com/,,Banking,"10,001+ employees","59,210 employees on LinkedIn",,1856,Private Banking & Wealth Management and Investment Banking
UBS Investment Bank,https://www.linkedin.com/company/1214/about/,"From gaining new experiences in different roles to acquiring fresh knowledge and skills – at UBS we believe that you should never stop growing and learning because life never stops teaching. We know that it's our people – with their unique backgrounds, skills, experience levels and interests – who drive our ongoing success. 
Ready to be part of #teamUBS and make an impact? Find out more at ubs.com/careers. 
UBS works with individuals, families, institutions, and corporations around the world to help answer some of life's questions – whether through award winning wealth management advisory, investment banking and asset management expertise, or private and corporate banking services in Switzerland*. 
With more than 71,000 colleagues around the world, we collaborate across all major financial centers in 50 countries**. Although we all come from different backgrounds and specializations, two things unite us: the conviction that we’re stronger together, and the will and curiosity to constantly innovate.  That’s the key to us unlocking our full potential (and what we look for in everyone who joins us). It’s also why we’re regularly recognized as an attractive employer.*

*Our awards https://www.ubs.com/awards
** As of 31 December 2020
Social Media Legal Terms: http://www.ubs.com/social-legal",http://www.ubs.com/about,,Financial Services,"10,001+ employees","84,296 employees on LinkedIn",,1862,"Financial Services, Investment Banking, Wealth Management, and Asset Management"
Powerhouse Ventures,https://www.linkedin.com/company/3589045/about/,"PV supports early-stage companies in high-growth sectors, where technology is the driver. PV enables its entrepreneurs to execute in dynamic markets, and, more importantly, places a premium on integrity and accountability. PV’s team works to foster entrepreneurial aptitude by supporting peer-to-peer learning, building enduring partnerships, and by encouraging entrepreneurs to use its network of exceptional business managers and domain experts as sounding boards.

The scale and intensity of Mobile Internet connectivity will not only give rise to start-ups disrupting traditional businesses but also propel the global economy into the next century. PV sees this promise in India and is busy building a portfolio of companies leading this transformation.",http://www.powerhouseventures.com,,Venture Capital and Private Equity Principals,2-10 employees,4 employees on LinkedIn,,2011,
Sluggr,https://www.linkedin.com/company/13217166/about/,Sluggr is a Singapore based Foodtech company. Sluggr helps you discover exciting bars & restaurants in Singapore.,http://www.sluggr.club,,Food and Beverage Services,2-10 employees,2 employees on LinkedIn,,,
AT Capital Pte. Ltd.,https://www.linkedin.com/company/3682733/about/,"Headquartered in Singapore, AT Capital Group was founded by Mr Arvind Tiku to consolidate and manage his family’s investments and holdings. The Group comprises AT Holdings, the asset owning company, and AT Capital, the in-house asset management entity.

AT Capital Group manages proprietary funds only. We invest extensively in markets that we understand, namely India, China, Singapore, and the CIS countries. We are open to both control and minority investments, where we see opportunities to generate and enhance value. AT Capital is well financed. Our single shareholding, flat structure and lean investment team provide us with the ability to evaluate and close transactions swiftly and effectively.

To maintain a balanced portfolio, we target both short-term open market instruments (debt, equity, metals and other liquid assets) and strategic mid-to-long-term investments in sectors of demonstrated expertise (infrastructure, real estate, hospitability and renewable energy). We are relatively sector agnostic but typically look for investing in high growth sectors.",http://atcapital.com.sg/,,Investment Management,11-50 employees,15 employees on LinkedIn,"Singapore, Singapore",,"Oil & Gas, Hotels & Leisure, Renewable Energy, and Real Estate"
PwC India,https://www.linkedin.com/company/1092713/about/,"At PwC, our purpose is to build trust in society and solve important problems.  We’re a network of firms in 155 countries with over 284,000 people who are committed to delivering quality in assurance, advisory and tax services. Find out more and tell us what matters to you by visiting us at www.pwc.com. 

In India, our highly qualified and experienced professionals listen to different points of view to help you solve business issues and identify and maximise the opportunities you seek. Our industry specialisation allows us to help co-create solutions with our clients for their sector of interest. 

PwC has offices in these cities: Ahmedabad, Bengaluru, Chennai, Delhi NCR, Hyderabad, Kolkata, Mumbai and Pune.",http://www.pwc.in,,Business Consulting and Services,"5,001-10,000 employees","13,899 employees on LinkedIn","Kolkata, West Bengal",,Tax and Advisory
Headline Asia,https://www.linkedin.com/company/71653093/about/,We invest in winning founders with global aspirations.,https://www.headline.com,,Venture Capital and Private Equity Principals,11-50 employees,24 employees on LinkedIn,,1998,
Figure,https://www.linkedin.com/company/18498808/about/,"Figure is transforming the trillion-dollar financial services industry using blockchain technology. In three short years, Figure has unveiled a series of fintech firsts using the Provenance Blockchain for loan origination, equity management, private fund services, banking, and payments sectors - bringing speed, efficiency, and savings to both consumers and institutions. Today, Figure is one of less than a thousand companies considered a unicorn, globally.

Figure was founded in 2018 by serial technology entrepreneur Mike Cagney, who also founded SoFi and built the company into a multi-billion dollar business under his leadership as CEO. 

This is an amazing opportunity to be part of a startup focused on solving real problems with blockchain. You will be part of a team with proven leaders who have created billions of dollars in value in the Fintech space. 

We're Hiring!  
https://figure.com/careers


Figure Lending LLC dba Figure. 15720 Brixham Hill Avenue, Suite 300, Charlotte, NC 28277. (888) 819-6388. NMLS ID 1717824. For licensing information, go to www.nmlsconsumeraccess.org. Equal Housing Opportunity. Terms apply. Visit figure.com for details.",http://www.figure.com,,Financial Services,"501-1,000 employees",548 employees on LinkedIn,"San Francisco, California",2018,"Home Equity Products, Blockchain, Consumer Lending, Financial Services, Asset Management, and Financial Technology"
BlueVine,https://www.linkedin.com/company/4989275/about/,"Bluevine is on a mission to enable a better financial future for small business owners through innovative banking solutions designed just for them. 

By combining industry-leading technology and security with our team's expertise and care, we help small businesses spend their time on what matters most—the next chapter of their business. 

As a dynamic company with massive potential, we’re backed by leading investors such as Lightspeed Venture Partners, Menlo Ventures, 83North, Citi Ventures, and nearly 9 years of proven success. Since launching in 2013, we have grown exponentially, amassing over 400,000 customers across all 50 states and providing more than $13 billion in financing to small businesses. Our passion is driven by purpose: to give small businesses the tools they need to succeed and we’re just getting started.

With a global presence of more than 500 employees, we're hiring problem solvers, innovators and collaborators to help build a better financial future for small business owners.",http://www.bluevine.com,,Financial Services,"501-1,000 employees",549 employees on LinkedIn,"Redwood City, California",2013,"Small businesses, Working capital financing, Invoice Financing, Business Line of Credit, Term Loan, Business Checking Account, and Small Business Banking"
Liquidity,https://www.linkedin.com/company/18225843/about/,"We are a credit automation leader, specializing in providing scaled, fast debt funding to high growth companies globally.
Backed by Spark Capital, MUFG and other leading financial institutions, with offices in New York, Miami, London, Tel Aviv, Abu Dhabi and Singapore we are ready to provide your company with well structured credit you require to grow, fast, utilizing our proprietary patented AI platform. 

We welcome you to apply.

We provide $3M - $100M funding, fast",https://www.liquiditygroup.com/?utm_campaign=linkedin&utm_medium=linkedin&utm_source=websiteurl,-2039,Capital Markets,51-200 employees,95 employees on LinkedIn,,2017,"Growth Funding, SaaS, fund raising, B round, c round, Funding, VC, growth, Tradjectory Funding, fintech, tech, insurtech, edtech, adtech, agrotech, healthtech, ITtech, consumertech, proptech, mediatech, streaming, gaming, venture debt, venture capital, and private equity"
Fundbox,https://www.linkedin.com/company/2933801/about/,"Fundbox is an embedded working capital platform for small businesses. As a leading provider of working capital, we use technology to help small businesses optimize cash flow. Since 2013, we have unlocked over $3 Billion in capital and connected to over 500,000 businesses.

Voted Forbes Best Startup Employers 2021-2022, certified Great Place to Work 2021-2022, and winner of the AI Breakthrough Awards.",https://fundbox.com,(855) 572-7707,Financial Services,201-500 employees,355 employees on LinkedIn,"San Francisco, CA",2013,"business financing, small business credit, business growth, business lending, business line of credit, small business, fintech, financing, credit, AI, machine learning, technology, PPP, and working capital"
Veem,https://www.linkedin.com/company/3674020/about/,"Veem helps small businesses save time and optimize cash flow by simplifying the way they send and receive payments domestically and internationally. Trusted by more than 500,000 users in over 100 countries, Veem uncomplicates the end-to-end AP/AR process with seamless integrations to leading accounting software, real-time tracking on payments and cost-effective, flexible payment options. Now businesses have the power to pay how they prefer and eliminate friction with customers to get paid faster. Veem holds all required licenses and works with regulated parties in every location it serves. veem.com/licenses/",https://www.veem.com,,Financial Services,51-200 employees,128 employees on LinkedIn,"San Francisco, CA",2014,"Global Payments, Money Transfers, and Blockchain Technology"
freee 株式会社,https://www.linkedin.com/company/2861339/about/,"Market Leader among Both Cloud-based Accounting and HR Software Providers in Japan

Vision
Create a platform that empowers anyone with ideas, passion and skills to easily grow a robust and streamlined business.

SERVICES
freee 会計 Accounting Freee
Accounting freee is an integrated accounting software solution optimized for SMBs. Accounting freee is designed to be easy to implement and use without specialized training in accounting or bookkeeping. We believe Accounting freee is a uniquely positioned, integrated solution, which enables customers to provides powerful functionality that enables customers to streamline their accounting functions and automatically integrate accounting data and other operational data to enhance overall operational efficiency and decision-making.

freee 人事労務 HR Freee
HR freee is a cloud-native integrated payroll software solution, providing payroll and other human resource related functions optimized for SMBs. HR freee provides core HR functions required by SMBs, including automated functionality for a number of functions that enables businesses to increase efficiency. HR freee supports a wide range of fully-integrated functions and tools, including.


Our Goal as a Team
Change the world with our movement

Create examples and the future
freee continues to push boundaries and be free from precedents or customs. freee leads various areas of business such as organizational strategy, operations, finance and human resources, and will create the future.
World-class quality
freee seeks to continue offering the best service to our users and always remain a global benchmark with the value our service provides. freee will continue to improve our products and services through investments from global investors and cultivate itself from their broad view.
Believe in members' growth
Only the growth of members can grow freee. freee makes great efforts to support each member, who possesses infinite possibilities, to allow them to grow and become a ""new me"".",https://www.freee.co.jp/,,IT Services and IT Consulting,"501-1,000 employees",439 employees on LinkedIn,"品川区, 東京都",2012,クラウドサービス開発・運営
Paidy,https://www.linkedin.com/company/3858692/about/,"株式会社Paidyは、日本において、業界をリードするあと払い（Buy Now Pay Later）サービス「ペイディ」を提供しています。「今買いたい！」を叶え、お支払いは「まとめてあとから」。シンプルなUX、翌月一括あと払いまたは分割手数料無料* の３回あと払いで支払いが可能な利便性、スマホで賢くお金の管理ができる点などから多くの方にご利用いただき、現在アカウント数は790万を超えています。70万店舗以上の販売店で利用いただけるほか、Visaのネットワークにより同オンライン加盟店およびデジタルウォレット、QR決済のお支払い方法としてペイディを利用できる「どこでもペイディ」のサービスも提供しています。ペイディアプリをお使いいただくと、欲しいアイテムの発見から購入までの一連のお買い物が、全てアプリ内で完結します。
「夢に自信を持ち、心に余裕を持てる世界」を作ることを目指して。お客様への信頼をもとに、どなたでも安心してお買い物を楽しめる環境を整えることが、ペイディの大事な使命です。

Paidy is Japan's pioneer and leading BNPL service with the mission to spread trust through society and to give people room to dream. Paidy offers instant, monthly-consolidated credit to consumers by removing hassles from payment and purchase experiences. Paidy uses proprietary models and machine learning to underwrite transactions in seconds and guarantee payments to merchants. Paidy increases revenue for merchants by reducing the number of incomplete transactions, increasing conversion rates, boosting average order values, and facilitating repeat purchases from consumers. Paidy continues to innovate to make shopping easier and more fun both online and offline.",http://www.paidy.com,,Financial Services,51-200 employees,161 employees on LinkedIn,"Minato-ku, Tokyo",2008,"FinTech, Payment, Credit, Cashless, Mobile, Finance, and BNPL"
Beam,https://www.linkedin.com/company/11804811/about/,"BEAM is based on Mimblewimble – an elegant protocol released by an anonymous developer in 2016. 

Named after a tongue-tying spell from the Harry Potter saga, Mimblewimble uses Pedersen Commitment scheme for full anonymity and zero-knowledge range proofs to ensure validity of transaction amounts.

To enhance privacy and reduce the blockchain size, Mimblewimble merges all intermediate outputs within a single block and across multiple blocks, thus only storing the current UTXO state and making the blockchain size an order of magnitude smaller than in other leading currencies.

BEAM team implemented Mimblewimble from scratch using C++. BEAM blocks are mined using memory-hard Equihash Proof-of-Work algorithm. The block time is 1 minute on taver- age.",https://www.beam.mw,,IT Services and IT Consulting,11-50 employees,31 employees on LinkedIn,"Tel Aviv, Center",2017,"financial privacy, blockchain, store of value, security coin, and cryptographics"
Fyle,https://www.linkedin.com/company/10438131/about/,"The world has changed over the last three decades and it’s time expense management does. 

Fyle has invented a new, intuitive way to turn expense reporting real-time. Employees submit expenses on-the-go within apps they use everyday - Gmail, Outlook, Slack, WhatsApp, phone gallery. There’s more -- all expenses are submitted only after being checked for policies. This means employees get notified right within these apps if they’re violating any company policies.

What’s more?
- A modern corporate card reconciliation software that’ll give your bank’s software a run for their money.
- Automation for literally any expense approval workflow -- dependent on employee, expense, policy -- give us your most complex one.
- Analytics that’ll keep you on top of everything expenses. MIS, budgets, team-wise spends, top violations, you name it.

Check out our detailed feature list to know everything about Fyle’s inner workings: https://www.fylehq.com/expense-management

Fyle is a fast growing company, trusted by Finance and Accounting leaders from over 300 organizations spread across 17 countries. Fyle is best suited for companies with over 100 employees and under 5000 employees.",https://www.fylehq.com,,Software Development,51-200 employees,112 employees on LinkedIn,"Newark, Delaware",2016,"Paperless Expense Management, Expense Management, Travel Expense Management, Business Expense Management, and Receipt Management"
DataWeave,https://www.linkedin.com/company/2256618/about/,"DataWeave is a digital commerce analytics SaaS platform that enables consumer brands and retailers to grow revenue and margins across online channels. Our revenue optimization solutions help them expand market share and compete profitably at scale. 

Our solutions for consumer brands include: 
Digital Shelf Analytics- We help you measure and optimize KPIs like content audit, availability, share of search, promotions and ratings and reviews to amplify your online sales.
Brand Protection- Safeguarding your brand integrity across online channels by monitoring your MAP pricing and by keeping track of counterfeit products across e-commerce channels. 

Our solutions for omnichannel retailers include:
Pricing Intelligence- Boost your margins and revenues by pricing your products right with the help of AI driving pricing insights. 
Assortment Analytics- Offer your customers nothing but a winning assortment to improve your customer loyalty and to boost retention and repeats. 

Our target markets include: Digital & Omnichannel Retailers, Consumer Brands, Food & Grocery Delivery, Travel",http://www.dataweave.com,,Software Development,201-500 employees,262 employees on LinkedIn,"Bangalore, Karnataka",2011,"Digital Shelf Analytics, Pricing Intelligence, Data Aggregation, Information Retrieval and Extraction, DaaS, Big Data, Brand Analytics, and MAP Violations"
Starship Technologies,https://www.linkedin.com/company/6646555/about/,"Starship Technologies is redefining the last mile delivery industry.

We build self-driving local delivery robots that are safe, reliable, clean and cost efficient. Starship was launched by Skype co-founders, Ahti Heinla and Janus Friis in 2014. Just a few years later, our robots are now doing thousands of deliveries a day in towns, cities and campuses across the world. 

Our business headquarters are located in San Francisco, and our main engineering office is in Estonia. Recently, we celebrated launching two new cities, an additional $17m in funding and completing 1.5 million autonomous deliveries. Join us and take a step into the future!",http://www.starship.xyz,,IT Services and IT Consulting,201-500 employees,603 employees on LinkedIn,"San Francisco, California",2014,Delivery
Open Financial Technologies,https://www.linkedin.com/company/13255289/about/,"Open is Asia’s first neobanking platform for SMEs and startups. We are on a mission to deliver a truly seamless business banking experience and make managing finances a breeze.
 
Powered by partner banks, Open offers a business account that let’s small business owners collect payments, auto-reconcile them, and make seamless payouts. We don’t stop with just that - we also offer additional tools designed exclusively for businesses, such as an integrated payment gateway, automated accounting and expense management. 
 
Open has been revolutionizing the way SMEs and startups bank since 2017 and we currently serve more than 15,00,000 SMEs and process US $24 Billion in transactions annually. The platform onboards 50,000 new SMEs and startups every month.
 
We are growing at an incredible pace and are on the lookout for new and exciting talent to join the Open tribe.",http://www.open.money,,Financial Services,201-500 employees,481 employees on LinkedIn,"Bangalore, Karnataka",2017,
ScoreData Corporation,https://www.linkedin.com/company/3486006/about/,"ScoreData helps businesses leverage their data to dramatically improve the quality of their engagement with their customers. The easy-to-use and simple-to-deploy nature of ScoreData’s Scorefast™ platform enables data scientists and business managers to create the most effective run-time consumer scores for fraud detection, churn-management, caller-agent mapping, recommendations and cross-sell applications. We leverage the most up-to-date best-of-breed open-source technologies.

                ScoreFast™ helps bring new data models to market in record time, and fosters collaboration among your business managers to build a broad range of enterprise applications. Our self-learning models ensure that hitherto expensive model building and updates will happen automatically thus dramatically lowering total cost of ownership. You can build your business insights by combining legacy models with newer data models and new data.

                If you are a business that seeks to track consumer behavior, and want to match consumers with your most optimal products or offers that meet their needs, or you are a business that is seeking to optimize workloads in the delivery chain without compromising customer satisfaction, then we have a solution for you. ScoreData solutions can be deployed across multiple touch-points such as mobile, web, kiosk and store. 

                ScoreData solutions have been used by some of the largest companies in the world.",http://www.scoredata.com,,Software Development,11-50 employees,9 employees on LinkedIn,"Palo Alto, CALIFORNIA",2012,"Data Analytics, Decision Sciences, Data Engineering, and ETL Services"
