Company_Name,Company_Profile,Overview,Website,Phone,Industry,Company_size,Company_size_Linkedin,Headquarters,Founded,Specialties
Jane Street,https://www.linkedin.com/company/1713404/about/,"Jane Street works differently. As a liquidity provider and market maker, we trade on more than 200 trading venues across 45 countries and help form the backbone of global markets. Our approach is rooted in technology and rigorous quantitative analysis, but our success is driven by our people.

Our bright, beautiful offices in the heart of New York, London, Hong Kong, and Amsterdam are open and buzzing with conversation. We come from many backgrounds and encourage travel between offices to share perspectives. Some of our best ideas come from bumping into a visiting colleague at the office coffee bar.

Markets move fast. Staying competitive as we’ve grown has required constant invention—of new trading strategies, technology, and processes. We’ve found this is easier when you hire humble, kind people. They tend to help each other, and prioritize teamwork over titles.

We invest heavily in teaching and training. There’s a library and a classroom in every office, because deepening your understanding of something is considered real work. Guest lectures, classes, and conferences round out the intellectual exchanges that happen every day.

People grow into long careers at Jane Street because there are always new and interesting problems to solve, systems to build, and theories to test. More than twenty years after our founding, it still feels like we’re just getting started.",http://www.janestreet.com,,Financial Services,"1,001-5,000 employees","1,450 employees on LinkedIn","New York, NY",2000,
Telefonica,https://www.linkedin.com/company/2103/about/,"Telefónica is today one of the largest telecommunications companies in the world in terms of market capitalisation and number of customers. We have the best infrastructure, as well as an innovative range of digital and data services; therefore, we are favorably positioned to meet the needs of our customers and capture growth in new businesses.

We are sensitive to the new challenges demanded by society today and, therefore, we provide the means to facilitate communication between people, providing them with the most secure and cutting-edge technology.

Our vision is focused on technology making people's lives easier and our aim is to promote progress in that direction, so that technology can make a positive impact on the world both socially and environmentally, and, ultimately, so as to provide value and trust in an ever-changing and accelerating world. Digital life is life itself, and technology is an essential part of being human. We want to create, protect and boost connections in life so people can choose a world of unlimited possibilities. 

We want to be a company in which our clients, employees, suppliers, shareholders, and society in general can trust. In order to achieve this, we communicate our strategy, business model and most relevant data to our stakeholders in a clear and transparent manner, so as to show the company's ability to create value.",http://www.telefonica.com,,Telecommunications,"10,001+ employees","116,768 employees on LinkedIn",,,"Fixed and mobile telephony, Broadband, pay TV and ITC services, Over the top services, Multinational Solutions, Digital Technology, Big Data, Machine-to-machine, Telecomunicaciones, Digitalización, Digitalization, and Network"
auravant,https://www.linkedin.com/company/9382637/about/,"Auravant is a leading SaaS digital platform that helps farmers and agronomists to make better agronomic decisions in the easiest possible way, improving yields and performing a more sustainable farming",https://bit.ly/3jkfJZb,+54 11 5365-4368,Farming,51-200 employees,64 employees on LinkedIn,"Capital Federal, CABA",2014,"agricultura, agtech, agricultura de precisión, and precision agriculture"
CORE & GLOBAL IT SOLUTIONS SL,https://www.linkedin.com/company/39786460/about/,,,,Computers and Electronics Manufacturing,11-50 employees,13 employees on LinkedIn,,,
MYSPHERA,https://www.linkedin.com/company/2633953/about/,"At MYSPHERA we put our expertise at the service of technology and people to automate, simplify and speed up🚀 the most complex processes of a healthcare organization.

Our goal🎯 is to free up health professionals from spending their time on anything but patient care.",http://mysphera.com/,,IT Services and IT Consulting,11-50 employees,56 employees on LinkedIn,"Paterna, Valencia",2012,"RTLS and RFID technologies., Real Time Location Systems., IoT healthcare, and IoT technologies"
Kenmei Technologies,https://www.linkedin.com/company/11565397/about/,"Kenmei Technologies is a Spanish company based in Valencia founded by telecoms and software experts, focused on providing data intelligence with machine-based decisioning, automating network operations and customer assurance, to help operators to deal with the incoming increase of network complexity.",https://www.kenmei.ai/,+34 960 07 01 72,Telecommunications,51-200 employees,74 employees on LinkedIn,"Paterna, Comunidad Valenciana / Comunitat Valenciana",2018,
sofiathinks,https://www.linkedin.com/company/49162896/about/,Sofia is the extraordinary combination of Software and Artificial Intelligence (AI) with the ability to think.,http://www.sofiathinks.es,,Computers and Electronics Manufacturing,11-50 employees,19 employees on LinkedIn,"Sevilla, Sevilla",2017,
CounterCraft​​ ,https://www.linkedin.com/company/10660741/about/,"CounterCraft empowers organizations to strengthen their security posture more efficiently than ever before. Designed and developed by experts, the CounterCraft Cyber Deception Platform fits seamlessly into existing security strategies and delivers high-end deception for threat hunting and threat detection using controlled, highly credible synthetic environments.

CounterCraft accelerates threat detection earlier in the attack lifecycle, provides evidence of malicious activity and modus operandis and already protects leading organizations in the financial, trade and government sectors, as well as law enforcement agencies. The feature-rich CounterCraft Cyber Deception Platform delivers high-quality alerts with zero false positives and automates cyber deception campaigns across a complete range of digital assets to strengthen overall security posture.

CounterCraft solution provides:
•	High-end deception
•	More than detection
•	Broad counterintelligence scope

CounterCraft is recognized worldwide for its radical contribution to the deception technology market and operates in more than 20 Fortune500 Index companies globally, including financial institutions, governments, and Law Enforcement Agencies.

To learn more about CounterCraft contact us at https://www.countercraftsec.com/contact.html",https://www.countercraftsec.com,,Computer and Network Security,51-200 employees,59 employees on LinkedIn,"New York, New York",2015,"cybersecurity, Deception Platform, Digital counterintelligence, IT security, threat hunting, threat detection, and threat intelligence"
iHackLabs,https://www.linkedin.com/company/10262759/about/,"We are an international cybersecurity firm created by renowned professionals, with an innovative vision and deep experience in the cybersecurity, technology and business consulting business. We were born to revolutionize the cybersecurity world and to provide new and differential services covering two existing needs in the market: IT Cybersecurity and Industrial Cybersecurity.

A new advanced and pragmatic approach to industrial cybersecurity and critical infrastructure protection. A unique offering and platforms to grow and develop the cybersecurity talent. Our approach and offering are unique and complementary to the existing services being provided by other players in the market (consulting firms, vendors, integrators, etc.), which allow us to create immediate synergies: collaboration is part of our DNA.

Moreover, we have one of the best cybersecurity training and simulation platforms worldwide, to help and support the improvement of cybersecurity capabilities and develop top-level cybersecurity talent.",https://www.ihacklabs.com,,IT Services and IT Consulting,2-10 employees,3 employees on LinkedIn,"London, London",2015,"Cyber-Talent, Industrial Cybersecurity, Red/Blue Team, and National Cybersecurity"
Genially,https://www.linkedin.com/company/9229212/about/,"Genially is a start-up that was founded in Spain with the goal of revolutionizing the world of communication. Like most great ideas, it was born from a need. : ""If technology has evolved, why do we keep using programs from 20 years ago?” 

In response to this question Juan Rubio, Luis García and Chema Roldán, the start-up’s co-founders decided to begin a project they’d name Genially. From the start, the tool’s focus was well-defined: innovation, interactivity, enriched content, sustainability and, above all, an easy-to-use tool accessible to everyone (online).

Only 4 years later, what began in 2015 as a dream of three entrepreneurs has become a project of over 120 employees, hundreds of brilliant ambassadors and a creation tool for millions of people in over 190 countries. Just a coincidence? See for yourself. 

Genially, for those searching for an alternative to traditional content. Create incredible communication experiences quickly and easily.",https://www.genial.ly,,Software Development,51-200 employees,220 employees on LinkedIn,"Córdoba, Córdoba",2015,"Contenidos Interactivos, Startup, Diseño, Contenidos Animados, Comunicación visual, Presentaciones, Infografías interactivas, Microsites, Interactive Content, Design, Animated Content, Visual Communication, Presentations, Interactive Infographics, Communication, Professional, content, visual, stories, business, customer, and experience"
Wayra,https://www.linkedin.com/company/2640795/about/,"Wayra is the entrepreneurship initiative part of Telefónica's Open Innovation programme, the most global, technological and connected in the world.

It has seven Wayra Hubs, spaces in nine countries in Latin America and Europe through which it invests in and supports startups; Wayra X, a digital hub to invest in 100% digital startups; Wayra Builder, a corporate venture builder to create, together with other investors, innovative startups born from Telefónica's internal technology projects; and Wayra Next Trend, a window to digital innovation on innovative trends and applications.

In addition, through the Wayra Activation Programme, it offers entrepreneurs exclusive and free access to new technologies through Telefónica's own platforms.

More than 500 of the startups invested are part of Telefónica's Open Innovation programme and more than 130 are doing business with the company. More information available at https://www.wayra.com/",https://wayra.com/,,IT Services and IT Consulting,51-200 employees,142 employees on LinkedIn,,2011,"Technology Startups, Mentoring, open innovation, corporate venturing, entrepreneurship, innovation, emprendimiento, innovación, startups, tech, and Telefónica"
MSA Capital,https://www.linkedin.com/company/18592571/about/,"Founded in 2014, MSA Capital is an independent global private equity and venture capital firm with over $2 billion under management. The firm manages capital from the world's top sovereign wealth funds, international asset managers, pension funds, university endowments, fund of funds and family offices, as well as China's leading new economy entrepreneurs. 

MSA actively partners with outstanding entrepreneurs in China and other technology markets to build leading, innovative companies that aim to deliver strong financial returns and meaningful, positive impact. The firm is headquartered in Beijing, with resident teams in Shanghai, Singapore, Middle East, North Africa and the United States.",http://www.msacap.com/,,Venture Capital and Private Equity Principals,11-50 employees,25 employees on LinkedIn,,,
Insight Partners,https://www.linkedin.com/company/21064/about/,"Insight Partners is a global software investor partnering with high-growth technology, software, and Internet startup and ScaleUp companies that are driving transformative change in their industries. As of February 24, 2022, the closing of the firm's recent fundraise, Fund XII, brings Insight Partners' regulatory assets under management to over $90B. Insight Partners has invested in more than 600 companies worldwide and has seen over 55 portfolio companies achieve an IPO. Headquartered in New York City, Insight has offices in London, Tel Aviv, and Palo Alto. Insight's mission is to find, fund, and work successfully with visionary executives, providing them with practical, hands-on software expertise to foster long-term success. Insight Partners meets great software leaders where they are in their growth journey, from their first investment to IPO. For more information on Insight and all its investments, visit insightpartners.com or follow us on Twitter @insightpartners.",http://www.insightpartners.com,,Venture Capital and Private Equity Principals,201-500 employees,546 employees on LinkedIn,"New York, NY",1995,"Software and Internet investing, Private Equity, and Venture Capital"
Team8,https://www.linkedin.com/company/3574763/about/,"Team8 is a global venture group with deep domain expertise that creates companies and invests in companies specializing in enterprise technologies, cyber, AI and fintech. Leveraging an in-house, multi-disciplinary team of company-builders integrated with a dedicated community of C-level executives and thought leaders, Team8’s model is designed to outline big problems, ideate solutions, and help accelerate success through technology, market fit and talent acquisition. Team8’s leadership team represents serial entrepreneurs, industry pioneers and the former leadership of Israel’s elite tech and intelligence Unit 8200. Founded in 2014, Team8 is backed by global companies including Microsoft, Walmart, Cisco, Barclays and Moody’s, among others. 
To learn more about Team8 visit www.team8.vc",http://team8.vc,,Venture Capital and Private Equity Principals,51-200 employees,129 employees on LinkedIn,,2014,"Cyber-Security, Venture Creation, Startups, Innovation, enterprise , digital transformation, data, AI, privacy, fintech, venture, and cyber"
SoftBank Investment Advisers,https://www.linkedin.com/company/27161398/about/,"At SoftBank Investment Advisers, we believe the next stage of the Information Revolution is underway. Through the SoftBank Vision Funds, we are investing more than $140 billion in the businesses and technologies that will help make it possible. We offer the operational expertise, global network and patient capital required to help exceptional founders build market-leading companies.

We are committed to building a world-class organization.  If you’re interested in a role with any of the SoftBank Investment Advisers entities, we want to hear from you.",https://www.visionfund.com,,Venture Capital and Private Equity Principals,201-500 employees,437 employees on LinkedIn,"London , United Kingdom",2017,
Viptela,https://www.linkedin.com/company/2761421/about/,"Viptela is a fast growing, private company that is disrupting network infrastructure technology that enterprises use to connect their facilities, users and applications. Featured in the Forbes, Wall Street Journal and leading trade-press journals, Viptela has emerged as a clear leader in the multi-billion Software-Defined WAN (SD-WAN) segment. Over 25 Fortune-500 companies deploy Viptela technology at thousands of sites on six continents, to drastically simplify their WAN infrastructure with over 50% cost-savings. Verizon and Singtel offer managed services, globally, based on Viptela's SD-WAN technology. 

Viptela’s secure, overlay WAN technology delivers to enterprises the benefit of: 
•	Unified and centralized management of all WAN infrastructure 
•	Reduced WAN infrastructure costs by over 50%
•	In-depth control & visibility of application performance 
•	Robust-zero trust WAN security 
•	Agility, by reducing network change control from months to days 

Viptela is backed by Sequoia Capital. A 3-minute video overview is here http://youtu.be/0iW-3tt4LH4",http://viptela.com,,Computer Networking Products,51-200 employees,18 employees on LinkedIn,"San Jose, CA",2012,"SDN, SD-WAN, vCPE, NFV, VNF, and WAN"
VCE,https://www.linkedin.com/company/1581903/about/,"Dell EMC: Converged Platforms & Solutions Division is focused on the next evolution of IT, the next generation data center and the future of cloud computing. 

Through our portfolio of converged solutions, Dell EMC accelerates the adoption of converged infrastructure and cloud-based computing solutions that reduce IT costs while improving time to market. We deliver the industry's only fully integrated and virtualized cloud infrastructure systems, allowing customers to focus on business innovation instead of integrating, validating, and managing IT infrastructure.",http://www.vce.com,,IT Services and IT Consulting,"1,001-5,000 employees",650 employees on LinkedIn,"Richardson, Texas",2009,"Infrastructure, networking, virtualization, computing, Converged Infrastructure, private cloud, hybrid cloud, hyper-converged infrasturcture, and high performance computing"
Cisco,https://www.linkedin.com/company/1063/about/,"Cisco (NASDAQ: CSCO) enables people to make powerful connections--whether in business, education, philanthropy, or creativity. Cisco hardware, software, and service offerings are used to create the Internet solutions that make networks possible--providing easy access to information anywhere, at any time. 

Cisco was founded in 1984 by a small group of computer scientists from Stanford University. Since the company's inception, Cisco engineers have been leaders in the development of Internet Protocol (IP)-based networking technologies. Today, with more than 71,000 employees worldwide, this tradition of innovation continues with industry-leading products and solutions in the company's core development areas of routing and switching, as well as in advanced technologies such as home networking, IP telephony, optical networking, security, storage area networking, and wireless technology. In addition to its products, Cisco provides a broad range of service offerings, including technical support and advanced services. 

Cisco sells its products and services, both directly through its own sales force as well as through its channel partners, to large enterprises, commercial businesses, service providers, and consumers.",http://www.cisco.com,,Software Development,"10,001+ employees","99,102 employees on LinkedIn","San Jose, CA",,"Networking, Wireless, Security, Unified Communication, Cloud, Collaboration, Data Center, Virtualization, and Unified Computing Systems"
Compass-EOS,https://www.linkedin.com/company/211574/about/,"Compass Networks is a next generation networking company. Its photonic backplane technology, icPhotonics™ powers ultra-bandwidth dense networking devices that bring networking into the age of modularity and virtualization.  Our icPhotonics™ technology is the world’s first commercial silicon for inter-chip optical interconnect. Its routers and SDN Forwarding Planes are a new breed of scale-out networking devices, enabling SDN-based, simplified architectures in service provider networks.",http://www.compassnetworks.com,,Computer Networking Products,51-200 employees,28 employees on LinkedIn,"Netanya, Please select",2006,
SYN Ventures,https://www.linkedin.com/company/74305974/about/,SYN Ventures is a venture capital firm primarily pursuing early-stage security sector opportunities run by security operators with decades of experience.,https://synventures.com,,Venture Capital and Private Equity Principals,2-10 employees,10 employees on LinkedIn,"West Palm Beach, Florida",2021,
ClearSky,https://www.linkedin.com/company/27279508/about/,"ClearSky is a venture capital/growth equity firm that has been operating since 2012 with offices in Florida, New York, Boston and San Francisco.

We are currently investing through two funds:

ClearSky Power & Technology and ClearSky Security.",http://www.clear-sky.com/,,Venture Capital and Private Equity Principals,11-50 employees,39 employees on LinkedIn,"West Palm Beach, Florida",2012,
Phylum,https://www.linkedin.com/company/47604408/about/,"Phylum is the future of software supply chain security. Our technology applies machine learning, deep analytics, and static code analysis to defend systems from more than known software vulnerabilities.",http://phylum.io,,Software Development,11-50 employees,31 employees on LinkedIn,"Evergreen, CO",2020,
RevealSecurity,https://www.linkedin.com/company/72435797/about/,"RevealSecurity detects malicious insiders and imposters by monitoring user journeys in enterprise applications. Powered by our unique clustering engine, RevealSecurity is ubiquitous, thereby detecting threats which originate from SaaS applications, cloud applications and custom-built applications. It protects enterprise organizations against cases in which either an authenticated user is taking advantage of permissions to abuse or misuse an application, or when an impersonator successfully bypasses authentication mechanisms and poses as a legitimate user. Tracking user journeys within applications does not rely on solution-specific rules, and is instead based on an advanced unsupervised machine learning algorithm to detect abnormal journeys which reflect abuse, misuse and malicious activities.",http://www.reveal.security,,Computer and Network Security,11-50 employees,34 employees on LinkedIn,,,"SaaS security , Anomaly detection for SaaS , CDR, Cloud Detection Response, SaaS Detection and Response , Machine learning, Artificial intelligence, User Behavior Analytics, UBA, Application Detection Response, ADR, UEBA, Log Management, Insider Threat Detection, and Anti-Fraud Analytics"
Netography,https://www.linkedin.com/company/35557404/about/,"Netography is the only company that delivers Security for the Atomized Network. In the Atomized Network applications and data are scattered across a complex environment consisting of multi-cloud, on-premise, and legacy infrastructure, all being accessed by increasingly mobile and remote workers. 

Netography Fusion®, a pure SaaS, universal platform, provides a single view of complete network visibility for real-time and retrospective attack detection across your entire footprint. Empowering enterprises with full visibility and control, Fusion provides custom threat detections, cloud and network visibility, and threat hunting. No hardware, no software, and nothing to deploy–with time-to-value within minutes. 

Based in Annapolis, MD, Netography is backed by some of the world’s leading venture firms, including Bessemer Venture Partners, SYN Ventures, A16Z, and more. For more information, visit netography.com.",https://www.netography.com,,Computer and Network Security,11-50 employees,39 employees on LinkedIn,"Annapolis, MD",2018,
Query.AI,https://www.linkedin.com/company/27190590/about/,"Query.AI provides the market’s only security investigations control plane for modern enterprises. Its browser-based platform delivers real-time access and centralized insights across on-premises, multi-cloud, and SaaS applications, without duplicating data from its native locations. 

With Query.AI, security teams gain a simple and effective way to meet their security investigation and response goals while simultaneously reducing costs.",https://www.query.ai,,Computer and Network Security,11-50 employees,43 employees on LinkedIn,"Brookings, South Dakota",2018,
SynSaber,https://www.linkedin.com/company/34688561/about/,"SynSaber is the industrial asset and network monitoring solution that provides continuous insight into status, vulnerabilities, and threats, enabling operators to more effectively see, know, and take action to defend industrial systems and protect critical infrastructure. Overcome industrial threats. Defend with laser precision. Navigate your security quest with confidence.",https://synsaber.com/,,Computer and Network Security,2-10 employees,8 employees on LinkedIn,,2020,Cyber Security
Okera,https://www.linkedin.com/company/7955186/about/,"Okera, the universal data authorization company, empowers enterprises to accelerate business agility, minimize data security risks and demonstrate regulatory compliance. The Okera Dynamic Access Platform automatically authorizes and audits all data requests, dynamically enforcing data security and compliance policies across all data platforms in hybrid and multi-cloud environments. Okera can be deployed into production in days, adapts to any common data authorization framework, and seamlessly integrates into existing data governance ecosystems. 

The company is headquartered in San Francisco and backed by Bessemer Venture Partners, ClearSky Security, and Felicis Ventures. For more information, visit www.okera.com or contact info@okera.com.",http://www.okera.com,+1 (415) 741-3282,Software Development,11-50 employees,83 employees on LinkedIn,"San Francisco, California",2016,"big data, data governance, data lake security, fine grain access control, data security, data lake auditing, secure data access, GDPR, CCPA Compliance, Data Privacy Software, and managing fine grain access control"
