Company_Name,Company_Profile,Overview,Website,Phone,Industry,Company_size,Company_size_Linkedin,Headquarters,Founded,Specialties
Scribble Ventures,https://www.linkedin.com/company/67207357/about/,"Scribble Ventures is an early-stage investment fund that focuses on Pre-Seed through Series A. We write initial checks of $300-750k — a sweet spot that allows Scribble to collaborate and co-invest with other strong angel investors and seed funds. Through our network of operators, executives, and investors, we help accelerate growth, recruiting, and future fundraising for our companies.",https://www.scribble.vc/,,Venture Capital and Private Equity Principals,2-10 employees,6 employees on LinkedIn,"Portola Valley, CA",2020,
Certn,https://www.linkedin.com/company/17891142/about/,"Certn is the leader in people intelligence solutions, using a people first mentality, our focus is on providing real-time comprehensive background checks and ongoing risk monitoring for employees, contractors and tenants around the world.
Used by leading employers, staffing firms, property management companies, and the gig economy, Certn returns domestic and international criminal background checks, credit reports, reference checks, education verification, employment verification, motor vehicle records, identity verification and more, in just minutes. Through innovative, friendly, and compliant technology, Certn can help you build trust through vital connections around the world.",http://www.certn.co,1 (844) 987-0690,IT Services and IT Consulting,51-200 employees,230 employees on LinkedIn,"Victoria, British Columbia",2016,"Risk Management, Credit Screening, Alternative Credit, Artificial Intelligence, Machine Learning, Algorithms, Credit, Social Credit, and Underbanked"
Runa,https://www.linkedin.com/company/22316561/about/,"Runa is a modern, cloud-based payroll and human resources software built for companies in Latin America. Companies can manage payroll, human resources, time tracking, performance management and reporting all in one platform.",http://www.runahr.com,,Human Resources Services,51-200 employees,187 employees on LinkedIn,"Polanco Reforma, Federal District",,"nómina, recursoshumanos, and seguros"
"Warmly,",https://www.linkedin.com/company/30583455/about/,"🌅 Have 2x better meetings with a personalized Virtual Business Card that acts as an immediate ice breaker on calls. Skip the formal “intros” and have your customized background signature showcase a bit about you. Need to impress for a call? Add the company logo of your prospects above your shoulder with a click.

👨‍👩‍👦‍👦 Look more professional as a team with a “virtual uniform”. Match backgrounds, logos & more. Team selling is not just 4 independent people showing up at different times - it’s your opportunity to stand out.

📆 Never prep for a meeting again with instant insights right in your calendar. Skip the Google search and supercharge your calendar with info on everyone you're meeting with. 

🥇 Winner of the 2021 Zoomtopia Innovation Award for best use of Zoom’s platform. Voted top 3 free Zoom App by Fast Company.",http://warmly.ai/,,Software Development,11-50 employees,23 employees on LinkedIn,,,
TrueNorth,https://www.linkedin.com/company/10665055/about/,"TrueNorth is one of the most successful fintech software development companies in the world having built three fintech unicorns from scratch, including Upgrade. The company specializes in building digital solutions, including 45 original enterprises, 120 digital transformations and 40 product revamps. 

TrueNorth’s unique Team Captain client-focused process enables our most senior engineers to navigate and apply the latest technologies to develop cutting-edge digital solutions for neobanks, fintechs, banks, credit unions, payment companies, lending firms, wealth management firms, and insurance companies. 

CEO Alex Gonikman, a veteran software architect, leads a staff of more than 170 employees with the company’s headquarters in New York City and development centers across the globe.",https://truenorth.co/,1-877-525-8783,IT Services and IT Consulting,51-200 employees,147 employees on LinkedIn,"New York City, NY",2015,"Software Development, FinTech, Software Design, Agile Teams, Technology Services, Frontend developers, Backend developers, Product Architecture, Mobile Development, Technology Migration, Custom Software Development, QA, UI/UX, Financial Services, Consulting, Neobanks, Banks, and Credit Unions"
Whatnot,https://www.linkedin.com/company/52160608/about/,"Whatnot: Buy, Sell & Go Live",http://www.whatnot.com,,"Technology, Information and Internet",201-500 employees,264 employees on LinkedIn,"Los Angeles, California",2019,
Titan,https://www.linkedin.com/company/11249478/about/,"“One of 2021’s Next Billion-Dollar Startups.” —Forbes Magazine, October 2021.

Your long-term wealth is our full-time job. Titan is investing done right: by experts, for you.

We’re actively hiring across all teams. Join us at titan.com/careers.

Follow us on LinkedIn to ride shotgun with our award-winning investment team and to learn more about our current and upcoming opportunities. 

You can also follow us on Twitter, Facebook, Instagram, and TikTok @titanvest.

Getting invested takes minutes. Download the Titan app today: titan.com

Not investing advice, no guarantee of future results. See disclosures.",http://www.titan.com,,Financial Services,51-200 employees,215 employees on LinkedIn,"New York, New York",,
Stanford University Graduate School of Business,https://www.linkedin.com/company/1791/about/,"The Stanford Graduate School of Business empowers individuals to envision what is possible and make it happen through principled leadership and creative problem solving. The school has built a global reputation based on its management and leadership programs, including the two-year MBA; the one-year MSx Program; the PhD Program; Stanford Ignite, a part-time program in innovation and entrepreneurship; and Executive Education. Each program creates an experience that transforms people and prepares them to change lives, change organizations, and change the world. Programs engage the highest quality students with world-class faculty from across Stanford University’s seven schools, as well as alumni, Silicon Valley professionals, global executives, and the broader world community. The state-of-the-art Knight Management Center offers flexible classroom spaces for hands-on experiential learning, small-group leadership labs, and team-based learning. It also serves as a convening space for major forums and discussions.",http://www.gsb.stanford.edu,6507232146,Higher Education,201-500 employees,"2,443 employees on LinkedIn","Stanford, CA",,"social innovation, entrepreneurship, global awareness, leadership, business, management, business school, and education"
Paperwheel,https://www.linkedin.com/company/42352720/about/,"Letterpress and design studio. 

Paperwheel Press is a letterpress print studio nestled in Portola Valley, California. Elizabeth Weil founded Paperwheel in 2006 after falling in love with a single letterpress business card while working in venture capital on Sand Hill Road. She started learning anything she could about the lost art of printing. Elizabeth combined her passions for hand-crafted tactile letterpress printing and the lasting art of the handwritten note to create simple, yet impactful, greeting cards and custom-designed wedding invitations, announcements, personal stationery, and more.

Elizabeth trail runs each morning, is an investor in the Silicon Valley by day, and prints and designs by night, weekends, and any other second she gets. She is an ultra-marathon runner, and in fact swears that that’s when she thinks of her best ideas.

The Paperwheel studio is home to a 1923 and a 1929 Chandler and Price Platen Press and an old-school guillotine paper cutter.

Paperwheel Press is a reflection of the little things that make up Elizabeth’s style, spirit, and energy.",https://paperwheel.com,,Manufacturing,2-10 employees,3 employees on LinkedIn,,2016,
the LEGO Group,https://www.linkedin.com/company/3724/about/,"At the LEGO Group, our mission is to inspire and develop the builders of tomorrow. We believe in the power of Learning-through-Play to shape children’s future. Through play, children learn skills – such as problem-solving, communication, creativity, collaboration, and resilience – that will help them reach their full potential.  

The LEGO® System-in-Play, with its foundation in LEGO bricks, allows children and fans of all ages to build and rebuild anything they can imagine. The LEGO name derives from the two Danish words ‘Leg Godt’, which means ‘Play Well.’

The LEGO Group was founded in Billund, Denmark, in 1932, by Ole Kirk Kristiansen. We still are a family-owned company with headquarters in Billund. Our play experiences are sold in more than 120 countries, and we are more than 20,000 colleagues worldwide working to achieve our ambition to bring Learning-through-Play to children everywhere.",http://www.lego.com,,Manufacturing,"10,001+ employees","14,404 employees on LinkedIn",,,"LEGO Bricks, Educational concepts, Consumer Experiences, Digital Play Experiences, Learning-through-Play, Creativity, and Imagination"
137 Ventures,https://www.linkedin.com/company/2061868/about/,"137 Ventures is a growth-stage venture firm that provides customized liquidity solutions to founders, investors, and early employees of high-growth private technology companies.",http://www.137.ventures,,Venture Capital and Private Equity Principals,11-50 employees,31 employees on LinkedIn,"San Francisco, CA",2011,"Pre-IPO, Venture Capital, Stock Options, Liquidity, ESO, and ISO"
Stanford University,https://www.linkedin.com/company/1792/about/,"Stanford is a place of discovery, creativity and innovation located in the San Francisco Bay Area on the ancestral land of the Muwekma Ohlone Tribe. Dedicated to our founding mission—benefitting society through research and education—we are working toward a sustainable future, accelerating the impact of research with external partners, catalyzing discoveries about ourselves and our world, and educating students as global citizens. Our main campus, which welcomed its first class in 1891, is now home to 650+ student organizations, 36 varsity athletic teams, 20 libraries, 20 living Nobel laureates, 18 interdisciplinary research institutes, seven schools, and a vibrant arts scene. More than 9,000 graduate students and 7,000 undergraduates pursue studies at Stanford each year. Our financial aid program, one of the most generous in the nation, makes it possible for any admitted undergraduate to attend without taking on student debt.",http://stanford.edu,,Higher Education,"10,001+ employees","23,551 employees on LinkedIn","Stanford, CA",,"higher education, research, teaching, natural sciences, social sciences, humanities, interdisciplinary research, engineering, business, medicine, law, k-12 education, and earth science"
Andreessen Horowitz,https://www.linkedin.com/company/439909/about/,"Founded in 2009 by Marc Andreessen and Ben Horowitz, Andreessen Horowitz (known as ""a16z"") is a venture capital firm in Silicon Valley, California, that backs bold entrepreneurs building the future through technology. We are stage agnostic: We invest in seed to late-stage technology companies, across the consumer, enterprise, bio/healthcare, crypto, and fintech spaces. a16z has $19.2B in assets under management across multiple funds, including the $1.4B Bio funds, the $3.1B Crypto funds, and the Cultural Leadership Fund.

a16z is defined by respect for the entrepreneur and the entrepreneurial company building process; we know what it’s like to be in the founder’s shoes. The firm is led by general partners, many of whom are former founders/operators, CEOs, or CTOs of successful technology companies, and who have domain expertise ranging from biology to crypto to distributed systems to security to marketplaces to financial services.

We aim to connect entrepreneurs, investors, executives, engineers, academics, industry experts, and others in the technology ecosystem. We have built a network of experts including technical and executive talent; top media and marketing resources; Fortune 500/Global 2000 companies; as well as other technology decision makers, influencers, and key opinion leaders. a16z uses this network as part of our commitment to help our portfolio companies grow their business, so our operating teams provide entrepreneurs with access to expertise and insights across the entire spectrum of company building.

https://a16z.com/portfolio/  
https://a16z.com/podcasts/  
https://a16z.com/videos/  
http://a16z.com/subscribe",http://www.a16z.com,,Venture Capital and Private Equity Principals,201-500 employees,533 employees on LinkedIn,"Menlo Park, CA",2009,
Twitter,https://www.linkedin.com/company/96622/about/,"Life’s not about a job, it’s about purpose. We believe real change starts with conversation. Here, your voice matters. Come as you are and together we’ll do what’s right (not what’s easy) to serve the public conversation. 

#JoinTheFlock",https://careers.twitter.com,,"Technology, Information and Internet","5,001-10,000 employees","8,038 employees on LinkedIn","San Francisco, CA",2006,Real-time information
Institutional Venture Partners,https://www.linkedin.com/company/267720/about/,"Like you, we are undaunted on the path to extraordinary outcomes. 

We help turn breakout companies into enduring market leaders. 

IVP’s 40-year track record of driving growth includes partnering with over 400 companies, resulting in over 130 IPOs  Our low-ego, hands-on approach has served companies like Amplitude, Brex, Coinbase, Discord, Klarna, Slack, Snap and Twitter in innumerable ways. 

We are unafraid of the challenges and hard work that come with becoming the dominant player. Our proven system bolsters key functions including those that are sometimes overlooked and our partners serve as trusted allies to CEOs seeking to realize their company’s full potential.

For more information visit ivp.com.",http://www.ivp.com,6508540132,Venture Capital and Private Equity Principals,11-50 employees,66 employees on LinkedIn,"Menlo Park, CA",1980,"venture capital, later-stage venture capital, growth equity, and investing in growth"
Menlo Ventures,https://www.linkedin.com/company/39208/about/,"Menlo Ventures provides capital for seed through growth technology companies in the consumer and enterprise sectors. For decades, the firm’s market-driven research analysis has led to the identification of and successful exits in innovative technology markets. Notable research areas of investment include Mobile (Siri, Uber, TeleNav), Enterprise Storage (3PAR, Spinnaker Networks, Coraid), Communications (Acme Packet, Cavium Networks), and Consumer (Fab, Tumblr, Carbonite, Roku). Founded in 1976, Menlo’s portfolio includes 70 public companies and more than 100 mergers and acquisitions. Throughout the firm's history, Menlo’s deep network of portfolio entrepreneurs, angels and advisors are a key resource made available to all of our family of investments. Menlo Ventures has $4 billion under management and is currently investing Menlo Ventures XIV, a $450 million fund. For more information, visit www.menlovc.com.",http://www.menlovc.com,,Venture Capital and Private Equity Principals,11-50 employees,73 employees on LinkedIn,"Menlo Park, California",1976,"Adtech, Ecommerce, Mobile, Gaming, New Media, Social & Web, Cloud & SaaS, Comms & Hardware, Security, Storage, Big Data, FinTech, SaaS, DevOps, Infrastructure, Marketplaces, and Life Sciences"
,,,,,,,,,,
Xfire,https://www.linkedin.com/company/31556/about/,"Xfire is the leader in social gaming services for core gamers. In July of 2012,  Xfire passed 22 million registered users.

Xfire was founded in 2003 and acquired by Viacom in 2008 for $102 million.

In August 2010 Xfire was spun out of Viacom by a private team of serial entrepreneurs and internet investors, including: Brock Pierce (IGE, Affinity Media), Mark Donovan (Titan Gaming), and William Quigley (Clearstone Venture Capital). The new team brings a wealth of experience, energy and focus that will further solidify Xfire’s leadership in the gaming space.

Xfire has recently released a re-vamped website and new UI/UX on its desktop and in-game client.

Further, it has launched a new competitive gaming service, Battleground into closed beta.

Battleground features 3 modes of competitive gaming; Instant Action (24/7 death match styled play), Challenges (direct wagering between users or clans) and Tournaments (multi-ladder, automated tournament system) supported by a full virtual eco-system of Xcoin (paid currency) and Battle Tokens (earned currency).

Xfire continues to provide users social networking, group VOIP and chat, social sharing of in-game screen shots and videos, and live-streaming gameplay. 

To learn more about Xfire and to download the client, please go to www.xfire.com.",http://www.xfire.com,,Computer Games,11-50 employees,24 employees on LinkedIn,"Santa Monica, CA",2002,"Internet, Gaming, Marketing, Startups, Social Media, Social Network, and Mobile"
AuctionDrop,https://www.linkedin.com/company/30555/about/,,,,"Technology, Information and Internet",51-200 employees,6 employees on LinkedIn,,,
U.S. Department of Commerce,https://www.linkedin.com/company/4835/about/,"The Department of Commerce’s mission is to create the conditions for economic growth and opportunity for all communities. Through its 13 bureaus, the Department works to drive U.S. economic competitiveness, strengthen domestic industry, and spur the growth of quality jobs in all communities across the country. The Department serves as the voice of business in the Federal Government, and at the same time, the Department touches and serves every American every day.

""Innovation, equity, and resilience. These three concepts drive our work at the U.S. Department of Commerce, and they’re crucial to our overarching goal of improving America’s competitiveness in the global economy."" Gina Raimondo, U.S. Secretary of Commerce",http://www.commerce.gov/,,Government Administration,"10,001+ employees","3,646 employees on LinkedIn","Washington, DC",1903,"Commerce, Cybersecurity, Fisheries, Aquaculture, Infrastructure, Intellectual Property, Investing, Manufacturing, Space Commerce, Trade Enforcement, Weather, Satellites, Export, 2020 Census, Data, ICT Supply Chain, First Responder Network, Minority Business Growth, Economic Development, Atmospheric Data, and Business"
Wells Fargo Corporate Finance,https://www.linkedin.com/company/1235/about/,"Wells Fargo & Company (NYSE: WFC) is a diversified, community-based financial services company with $1.9 trillion in assets. Wells Fargo’s vision is to satisfy our customers’ financial needs and help them succeed financially. Founded in 1852 and headquartered in San Francisco, Wells Fargo provides banking, investment and mortgage products and services, as well as consumer and commercial finance, through 8,050 locations, 13,000 ATMs, the internet (wellsfargo.com) and mobile banking, and has offices in 38 countries and territories to support customers who conduct business in the global economy. With approximately 265,000 team members, Wells Fargo serves one in three households in the United States. Wells Fargo & Company was ranked No. 26 on Fortune’s 2018 rankings of America’s largest corporations. News, insights and perspectives from Wells Fargo are also available at Wells Fargo Stories. 

Relevant military experience is considered for veterans and transitioning service men and women. 
Wells Fargo is an Affirmative Action and Equal Opportunity Employer, Minority/Female/Disabled/Veteran/Gender Identity/Sexual Orientation. © 2016 Wells Fargo Bank, N.A. All rights reserved. Member FDIC.",http://www.wellsfargo.com,,Financial Services,"10,001+ employees","267,797 employees on LinkedIn","San Francisco, California",,"Business Banking, Wholesale banking, Mortgage, Consumer Finance, and Commercial Finance"
Seven Seven Six 7️⃣7️⃣6️⃣,https://www.linkedin.com/company/69044852/about/,Venture Capital Firm,http://sevensevensix.com,,Financial Services,2-10 employees,20 employees on LinkedIn,,2020,
Initialized Capital,https://www.linkedin.com/company/6355249/about/,"Initialized Capital is a San Francisco-based early stage venture capital firm with over $700M in assets under management. We're early investors in Coinbase, Instacart, Cruise, Rippling, Opendoor, and more — $200B+ in market value.

We're founders and builders who are here to help others like us build meaningful businesses. We focus on investing in high-potential software startups at seed stage and earlier, and are happy to be the first investors in early teams run by great engineers, designers and product founders. 

We've helped more founders build startups at the earliest possible stage than most anyone you'll meet, and that means we can help startups avoid the 1,000 landmines that can cause certain failure. It certainly won't guarantee success (as we all know there's no such thing in startups) but at the seed stage we've seen many cases where having the right investors will improve your chances significantly. 

In the end, we started this firm to help people like ourselves build companies that matter. A lot of great investors, advisors, founders, and friends have helped us along the way. We're just here to pay it forward.",http://initialized.com,,Venture Capital and Private Equity Principals,11-50 employees,38 employees on LinkedIn,"San Francisco, CA",2016,
Reddit,https://www.linkedin.com/company/150573/about/,"Reddit is a network of more than 100,000 communities where people can dive into anything through experiences built around their interests, hobbies and passions. Reddit users submit, vote and comment on content, stories and discussions about the topics they care about the most. From pets to parenting, there’s a community for everybody on Reddit. Interested in joining our growing team? Check out redditinc.com/careers",http://redditinc.com,,"Technology, Information and Internet","501-1,000 employees","2,424 employees on LinkedIn","San Francisco, California",2005,"Software Engineering, Full-Stack Engineering, Frontend Engineering, Backend Engineering, Social Media, Data Science , Mobile Apps, and Online Advertising"
Y Combinator,https://www.linkedin.com/company/167872/about/,"Y Combinator (YC) is a startup fund and program. Since 2005, YC has invested in nearly 3,000 companies including Airbnb, DoorDash, Stripe, Instacart, Dropbox, and Coinbase. The combined valuation of YC companies is over $300B. YC has programs and resources that support founders throughout the life of their company. Startup School teaches the basics of starting a company. The YC batch program helps founders as they build their product, talk to their customers, and raise funding. Work at a Startup makes it easy for founders to find their first engineers. YC Series A helps founders launch their A round. YC Growth Program provides founders with resources to scale their companies and hire an executive team, and YC Continuity invests in their later stage rounds.",http://www.ycombinator.com/,,Venture Capital and Private Equity Principals,11-50 employees,"2,119 employees on LinkedIn",,2005,
Hipmunk,https://www.linkedin.com/company/1093828/about/,"Hipmunk is making travel planning simple and delightful. The site and mobile apps save you time by comparing top travel sites so you don't have to. The unique display makes it easy to visually compare results and choose what's best for you. Hipmunk brings in travel options ranging from commercial flights to trains to charter flights and accommodations ranging from large hotels to home and apartment rentals through Airbnb and Homeaway. Users can find less agonizing flights with the innovative flight search “Agony” sort, as well as the best hotels and home rentals with the hotel search “Ecstasy” sort. 

Hipmunk is one of TIME Magazine’s “50 Coolest Websites,” TIME Magazine’s “50 Best Smartphone Apps,” Travel + Leisure’s “Best Websites of 2012,” Budget Travel’s “Top 10 Most Useful Websites,” and Inc.’s “Best Booking Website.” Co-founders Adam Goldstein and Steve Huffman were named to Bloomberg BusinessWeek’s “Top Tech Entrepreneurs,” Forbes “30 Under 30” and Inc.’s “30 Under 30” lists. The company launched in 2010, is based in San Francisco, and has funding from IVP, Ignition Partners, Y Combinator, SV Angel, Webb Investment Network, Quest Hospitality Ventures, and several angel investors.

SAP privacy statement for followers: http://www.sap.com/sps",http://www.hipmunk.com,,"Technology, Information and Internet",51-200 employees,12 employees on LinkedIn,"San Francisco, CA",2010,"flights, hotels, travel, online travel, and business travel"
